以混沌与秩序为基础,,,,
准备：卡牌，每人35张；英雄卡，每人一张；损失生命标识、精神点数标识，眩晕标识，中毒标识，异能标识若干备用；,,,,
桌面：中间5个空位，用于安置随从，左边放英雄，右边是墓地,,,,
随从牌: 放置到战场五个格子里，下回合开始可攻击，可以攻击对面随从，如果正对面没有随从则可以伤害英雄；随从有攻防血，有自己的异能，减血用生命损失标记指示，攻防血费最多不超过9，分人型生物，自然生物，灵体生物，机械生物，未知。分普通，银卡，金卡；随从牌都是共有牌，所有职业都可以使用,,,,
招式牌，打出后触发技能，然后进入弃牌区，技能都是不同职业英雄独享的,,,,
装备牌，放置到随从身上，每个随从只能装备一个。多则取代上一个。装备都是各个职业特有，每张装备牌都有指示用于哪种或哪几种随从。带有装备的随从移出战场时装备同时移出,,,,
英雄牌，代表自己，有血，不等，减少到0则输掉，有手牌量，代表最大手牌量，有防御，有一个或多个异能。,,,,
先手从一水晶开始，后手两水晶，下回合开始增加一个，最大10个。,,,,
只出卡牌，不制定规则，规则由玩家集思广益，因此以上规则失效,,,,
卡牌分成4大类：生物，领域，,,,,